{
  "name": "rf-power-connected-soak",
  "quantum_seconds": 0.0001,
  "virtual_time_ms": 10000,
  "sample_count": 50,
  "nodes": [
    {
      "name": "rf",
      "layout": "../../RFBoard26/sim/board.json",
      "firmware_root": "../../RFBoard26"
    },
    {
      "name": "power",
      "layout": "../../PowerBoard26/sim/board.json",
      "firmware_root": "../../PowerBoard26"
    }
  ],
  "links": [
    {
      "name": "avionics_can",
      "kind": "can",
      "endpoints": [
        {"node": "rf", "peripheral": "fdcan2", "activity_probe": "fdcan_irqs"},
        {"node": "power", "peripheral": "fdcan2", "activity_probe": "fdcan_irqs"}
      ]
    }
  ]
}
